{
  "$schema": "https://json-schema.org/draft/2020-12/schema",
  "$id": "https://sightline.herwig-systems.de/catalog/schema.json",
  "title": "Sightline catalogue product",
  "description": "Generated from src/catalog/schema.ts — do not edit by hand.",
  "$ref": "#/$defs/Product",
  "$defs": {
    "Txt": {
      "description": "A bilingual text. Both languages are mandatory — `tx()` picks one.",
      "type": "object",
      "properties": {
        "de": {
          "type": "string"
        },
        "en": {
          "type": "string"
        }
      },
      "additionalProperties": false,
      "required": ["de", "en"]
    },
    "Tags": {
      "description": "Bilingual word lists: the search tags on a card.",
      "type": "object",
      "properties": {
        "de": {
          "type": "array",
          "items": {
            "type": "string"
          }
        },
        "en": {
          "type": "array",
          "items": {
            "type": "string"
          }
        }
      },
      "additionalProperties": false,
      "required": ["de", "en"]
    },
    "Port": {
      "description": "One connector as the data sheet lists it — and the only place that says what a device can be wired to. `dir` is about the cable, not the data: `in` takes an uplink or a feed (a camera's socket, a switch's PoE-in port, an injector's data jack), `out` only ever goes downstream (an injector's PoE jack), `both` is an ordinary switch port that an uplink or a camera can land on alike. `wan` is where the internet arrives and never counts as a LAN port.",
      "type": "object",
      "properties": {
        "type": {
          "enum": ["rj45", "sfp", "sfp+", "dc", "wan"]
        },
        "dir": {
          "enum": ["in", "out", "both"]
        },
        "n": {
          "description": "How many of this kind. An SFP module has an interface but brings no cage: `0`.",
          "type": "number"
        },
        "speed": {
          "description": "\"1G\", \"2.5G\", \"10G\", \"100M\", \"1G/2.5G\" — as printed, not normalised.",
          "type": "string"
        },
        "poe": {
          "description": "PoE class this port hands out. `\"af/at\"` is a port that negotiates either.",
          "enum": ["af", "at", "bt", "af/at"]
        }
      },
      "additionalProperties": false,
      "required": ["type", "dir", "n"]
    },
    "Beam": {
      "description": "Radiation pattern of an access point. `h: 360` is omnidirectional.",
      "type": "object",
      "properties": {
        "h": {
          "description": "Horizontal opening in degrees, on the band the reliable zone is drawn from (5 GHz).",
          "type": "number"
        },
        "hFar": {
          "description": "Horizontal opening of the wider, lower band (2.4 GHz), which is what the outer free-field ring shows. Absent means the same as `h`.",
          "type": "number"
        },
        "v": {
          "description": "Vertical opening in degrees, where the vendor publishes one.",
          "type": "number"
        },
        "back": {
          "description": "Rear lobe as a fraction of the main lobe, 0…1. An omni is 1.",
          "type": "number"
        }
      },
      "additionalProperties": false,
      "required": ["h"]
    },
    "Openness": {
      "description": "How far a camera can be driven without the vendor's own console or app. A field that no data sheet confirmed is left out rather than guessed — \"unknown\" and \"no\" are different answers.",
      "type": "object",
      "properties": {
        "rtsp": {
          "description": "`\"via-console\"`: only the vendor's recorder re-streams it.",
          "anyOf": [
            {
              "type": "boolean"
            },
            {
              "const": "via-console"
            }
          ]
        },
        "onvif": {
          "type": "boolean"
        },
        "api": {
          "enum": ["none", "community", "documented"]
        },
        "cloud": {
          "description": "`\"required\"`: nothing works without the vendor cloud.",
          "enum": ["optional", "required"]
        }
      },
      "additionalProperties": false
    },
    "Codecs": {
      "description": "Video codecs per stream, lower-case tokens (\"h264\", \"h265\").",
      "type": "object",
      "properties": {
        "main": {
          "type": "array",
          "items": {
            "type": "string"
          }
        },
        "sub": {
          "type": "array",
          "items": {
            "type": "string"
          }
        }
      },
      "additionalProperties": false,
      "required": ["main"]
    },
    "Links": {
      "description": "Where to buy it. `vendor` is a path under the UniFi store or an absolute URL.",
      "type": "object",
      "properties": {
        "vendor": {
          "type": "string"
        },
        "amazon": {
          "description": "A verified `https://www.amazon.de/dp/<ASIN>` — never guessed.",
          "type": "string"
        },
        "amazonSimilar": {
          "description": "The Amazon link is an equivalent substitute, not the original item.",
          "type": "boolean"
        }
      },
      "additionalProperties": false
    },
    "Specs": {
      "description": "The numbers the planner computes with. Every field is optional here because one file serves four kinds; which ones a kind must carry is checked in tests/unit/catalog.test.ts.",
      "type": "object",
      "properties": {
        "res": {
          "description": "\"4K · 8 MP · 1/1.8\\\"\" — \"4K\" in it counts as 4K for the NVR warning.",
          "type": "string"
        },
        "ir": {
          "description": "Night-vision range in m; drives the cone radius.",
          "type": "number"
        },
        "fov": {
          "description": "Opening in degrees; 360 means pan/tilt and is drawn as a circle.",
          "type": "number"
        },
        "zoom": {
          "description": "Optical or hybrid zoom, as printed.",
          "type": "string"
        },
        "poe": {
          "description": "How it is powered, as printed (\"PoE+ (802.3at)\").",
          "anyOf": [
            {
              "type": "string"
            },
            {
              "$ref": "#/$defs/Txt"
            },
            {
              "type": "number"
            }
          ]
        },
        "ip": {
          "description": "IP/IK rating, as printed.",
          "type": "string"
        },
        "out": {
          "description": "Set explicitly, never guessed from `ip` — drives the mount row and the filters.",
          "type": "boolean"
        },
        "wifi": {
          "description": "Camera: runs on Wi-Fi. Access point: the radio, as printed.",
          "anyOf": [
            {
              "type": "boolean"
            },
            {
              "type": "string"
            }
          ]
        },
        "radius": {
          "description": "Rough free-field range in m.",
          "type": "number"
        },
        "place": {
          "enum": ["in", "out"]
        },
        "ports": {
          "description": "Conduit openings on a housing (and fibre entries on a splice closure). A device's network ports are **not** here: they come out of `ports`.",
          "type": "number"
        },
        "power": {
          "description": "Active device: it needs a place of its own, not necessarily mains power.",
          "type": "boolean"
        },
        "dig": {
          "description": "Goes into the ground; drives the select groups.",
          "type": "boolean"
        },
        "use": {
          "description": "One line on the card: what the part is for.",
          "$ref": "#/$defs/Txt"
        },
        "extend": {
          "description": "A PoE extender raises the copper limit of its run, in m.",
          "type": "number"
        },
        "poeDraw": {
          "description": "Load on the feeder for a `powerIn: \"poe\"` device; 15 W when absent.",
          "type": "number"
        },
        "role": {
          "description": "Exactly one entry per plan carries `\"router\"`.",
          "type": "string"
        },
        "qty": {
          "description": "Default quantity when the item is switched on.",
          "type": "number"
        },
        "on": {
          "description": "Preselected in a fresh plan — always false, the plan starts empty.",
          "type": "boolean"
        },
        "hidden": {
          "description": "Kept out of the gear tab (switches sit on the map as elements).",
          "type": "boolean"
        },
        "sub": {
          "description": "The subtitle under the name in the gear tab.",
          "$ref": "#/$defs/Txt"
        }
      },
      "additionalProperties": false
    },
    "Product": {
      "description": "One catalogue entry.",
      "type": "object",
      "properties": {
        "id": {
          "type": "string"
        },
        "kind": {
          "description": "Which catalogue it lands in.",
          "enum": ["cam", "ap", "jb", "infra"]
        },
        "form": {
          "description": "Junctions only: a place (`housing`) or something that goes into one (`device`).",
          "enum": ["housing", "device"]
        },
        "vendor": {
          "description": "`\"any\"` = vendor-neutral (shaft, box, cabinet); it passes every vendor filter.",
          "type": "string"
        },
        "status": {
          "description": "Anything but `current` is hidden from the pickers unless \"show deprecated\" is on.",
          "enum": ["current", "deprecated", "eol"]
        },
        "successor": {
          "description": "The id that replaces this one. Only with a status other than `current`.",
          "type": "string"
        },
        "order": {
          "description": "Sort key inside the kind, in steps of ten so something fits in between.",
          "type": "number"
        },
        "name": {
          "$ref": "#/$defs/Txt"
        },
        "price": {
          "description": "EUR including VAT.",
          "type": "number"
        },
        "priceDate": {
          "description": "When the price was last checked, `YYYY-MM`.",
          "type": "string"
        },
        "description": {
          "description": "Two sentences for the card and the data sheet.",
          "$ref": "#/$defs/Txt"
        },
        "useCases": {
          "description": "\"Good for\" on the data sheet.",
          "$ref": "#/$defs/Txt"
        },
        "caveats": {
          "description": "\"Less suited\" on the data sheet.",
          "$ref": "#/$defs/Txt"
        },
        "links": {
          "$ref": "#/$defs/Links"
        },
        "img": {
          "description": "Image URL at the vendor. A local `image.webp` in the same folder wins.",
          "type": "string"
        },
        "tags": {
          "$ref": "#/$defs/Tags"
        },
        "mount": {
          "description": "Where it goes (junctions).",
          "$ref": "#/$defs/Txt"
        },
        "powerIn": {
          "description": "Where a device draws power from. Housings carry none.",
          "enum": ["mains", "poe", "none"]
        },
        "ports": {
          "description": "The connectors as the data sheet lists them.",
          "type": "array",
          "items": {
            "$ref": "#/$defs/Port"
          }
        },
        "poeIn": {
          "description": "The PoE class the device itself accepts.",
          "enum": ["af", "at", "bt", "af/at"]
        },
        "beam": {
          "$ref": "#/$defs/Beam"
        },
        "open": {
          "$ref": "#/$defs/Openness"
        },
        "codecs": {
          "$ref": "#/$defs/Codecs"
        },
        "specs": {
          "$ref": "#/$defs/Specs"
        },
        "$schema": {
          "type": "string"
        }
      },
      "additionalProperties": false,
      "required": ["id", "kind", "vendor", "status", "order", "name", "price", "priceDate", "specs"]
    }
  }
}
