{
  "$schema": "../schema.json",
  "id": "shaft-s",
  "kind": "jb",
  "form": "housing",
  "vendor": "any",
  "status": "current",
  "order": 20,
  "name": {
    "de": "Kabelschacht DN 200 (klein)",
    "en": "Cable shaft DN 200 (small)"
  },
  "price": 37,
  "priceDate": "2026-09",
  "description": {
    "de": "Kleinere Ausführung des Standardschachts, 200×200×200 mm: reicht für einen Abzweig mit zwei, drei dünnen Rohren. Ab vier Kanälen wird es eng, dann der große Schacht.",
    "en": "Smaller version of the standard shaft, 200×200×200 mm: enough for a branch with two or three thin conduits. Gets tight from four channels on, then take the larger shaft."
  },
  "useCases": {
    "de": "Ein kleiner Abzweig mit höchstens zwei, drei dünnen Rohren.",
    "en": "A small branch with at most two or three thin conduits."
  },
  "caveats": {
    "de": "Nicht wenn später mehr Rohre dazukommen — dafür ist der große Schacht da.",
    "en": "Not if more conduits get added later — the larger shaft is there for that."
  },
  "links": {
    "vendor": "https://www.kabelschacht24.de/p/e-trick-pp-k20-kabelschacht-aus-kunststoff-begehbare-abdeckung"
  },
  "img": "https://www.kabelschacht24.de/storage/images/image?remote=https%3A%2F%2Fwww.kabelschacht24.de%2FWebRoot%2FStore16%2FShops%2F61464916%2F4873%2F6E86%2F68EA%2F50ED%2F3AB8%2FC0A8%2F28BA%2FEF84%2FPPK30.jpg&shop=61464916",
  "tags": {
    "de": ["Erdarbeit", "kein Strom", "später zugänglich"],
    "en": ["earthwork", "no power", "reachable later"]
  },
  "mount": {
    "de": "Erdeinbau, Deckel begehbar",
    "en": "Buried, walk-on lid"
  },
  "specs": {
    "ip": "IP54",
    "ports": 4,
    "power": false,
    "dig": true,
    "use": {
      "de": "kleiner Abzweig für zwei, drei dünne Rohre",
      "en": "small branch for two or three thin conduits"
    }
  }
}
