{
  "$schema": "../schema.json",
  "id": "ucg",
  "kind": "infra",
  "vendor": "ubiquiti",
  "status": "current",
  "order": 10,
  "name": {
    "de": "UniFi Cloud Gateway Fiber",
    "en": "UniFi Cloud Gateway Fiber"
  },
  "price": 250,
  "priceDate": "2026-09",
  "description": {
    "de": "Router, Netzwerk-Controller und Protect-Rekorder in einem Gerät, dazu zwei SFP+-Ports für Glasfaser. Nimmt rund fünf 4K-Kameras auf; der Speicher steckt als NVMe darin.",
    "en": "Router, network controller and Protect recorder in one box, plus two SFP+ ports for fibre. Records about five 4K cameras; the storage is an NVMe inside it."
  },
  "useCases": {
    "de": "Ein Gerät für alles: Router, Controller und Aufzeichnung, wenn die Kameras von UniFi kommen.",
    "en": "One box for everything: router, controller and recording, when the cameras are UniFi."
  },
  "caveats": {
    "de": "Nicht bei DSL-Zwang mit Telefonie — und nicht für mehr als rund fünf 4K-Kameras ohne UNVR.",
    "en": "Not where DSL with telephony is mandatory — and not for more than about five 4K cameras without a UNVR."
  },
  "links": {
    "vendor": "unifi-cloud-gateways/collections/cloud-gateway-fiber/products/ucg-fiber",
    "amazon": "https://www.amazon.de/dp/B0FD86XR36"
  },
  "img": "https://cdn.ecomm.ui.com/products/48cf74fa-0456-4c5f-bbcc-c1a1ffdc11f9/465257f3-0acc-4a11-bb15-762e7f6c0e9c.png",
  "ports": [
    {
      "type": "rj45",
      "dir": "out",
      "n": 4,
      "speed": "2.5G"
    },
    {
      "type": "wan",
      "dir": "in",
      "n": 1,
      "speed": "10G"
    },
    {
      "type": "wan",
      "dir": "in",
      "n": 1,
      "speed": "10G"
    },
    {
      "type": "sfp+",
      "dir": "both",
      "n": 1,
      "speed": "10G"
    }
  ],
  "specs": {
    "role": "router",
    "poe": 30,
    "qty": 1,
    "on": false,
    "sub": {
      "de": "Router, Controller, Protect-NVR · 2× SFP+",
      "en": "Router, controller, Protect NVR · 2× SFP+"
    }
  }
}
